number,value,datetime_start,datetime_complete,duration,params_alpha,params_bagging_temperature,params_bootstrap_type,params_classifier,params_colsample_bytree,params_depth,params_gamma,params_iterations,params_l2_leaf_reg,params_lambda,params_learning_rate,params_max_depth,params_min_child_samples,params_min_child_weight,params_min_data_per_groups,params_n_estimators,params_num_leaves,params_od_type,params_od_wait,params_random_strength,params_reg_alpha,params_reg_lambda,params_subsample,state
85,1255.9246433375538,2023-02-14 19:04:45.269327,2023-02-14 19:06:14.639714,0 days 00:01:29.370387,,,,LGBM,0.799889341717941,,,,,,0.013722613662897756,9.0,227.0,,35.0,,810.0,,,,0.010814988701494763,0.04288522177837847,0.7011138401153697,COMPLETE
86,1252.8889392803053,2023-02-14 19:06:14.641715,2023-02-14 19:07:34.692980,0 days 00:01:20.051265,,,,LGBM,0.7602477237498595,,,,,,0.014836130977153344,8.0,203.0,,65.0,,680.0,,,,0.0027038934420193575,0.020301573249838997,0.628512036890617,COMPLETE
87,1557.9392172210487,2023-02-14 19:07:34.693978,2023-02-14 19:08:39.166687,0 days 00:01:04.472709,,3.532954066054366,Bayesian,CatBoost,,10.0,,736.0,71.36149814904601,,0.010814360850395026,,,,,,,Iter,21.0,0.046257066063241155,,,,COMPLETE
88,1251.5468794830024,2023-02-14 19:08:39.167689,2023-02-14 19:09:47.489275,0 days 00:01:08.321586,,,,LGBM,0.8189331083624958,,,,,,0.026123091001004826,7.0,251.0,,52.0,,872.0,,,,0.005796592278593976,0.16859717240852073,0.6718816076946182,COMPLETE
89,1241.7300514673962,2023-02-14 19:09:47.491276,2023-02-14 19:10:50.344614,0 days 00:01:02.853338,,,,LGBM,0.7112961354204334,,,,,,0.01000459948861963,6.0,196.0,,26.0,,609.0,,,,0.011991551941371538,0.01067648589816631,0.7248622498231816,COMPLETE
90,1248.8229365756806,2023-02-14 19:10:50.346614,2023-02-14 19:12:12.793424,0 days 00:01:22.446810,,,,LGBM,0.7119141049567109,,,,,,0.010076795002307064,8.0,180.0,,10.0,,581.0,,,,0.011897504882390527,0.009521562059697475,0.719889278561674,COMPLETE
91,1237.6259158034393,2023-02-14 19:12:12.795424,2023-02-14 19:13:18.189662,0 days 00:01:05.394238,,,,LGBM,0.6447519572739667,,,,,,0.017935849432015576,6.0,197.0,,57.0,,952.0,,,,0.00488598237851377,0.08169486223175351,0.7710079289936309,COMPLETE
92,1242.916915762885,2023-02-14 19:13:18.191662,2023-02-14 19:14:27.868066,0 days 00:01:09.676404,,,,LGBM,0.7435789829035269,,,,,,0.02317637853961546,6.0,240.0,,57.0,,986.0,,,,0.004836849988454211,0.08033873387414553,0.7717610038514481,COMPLETE
93,1252.6602213698484,2023-02-14 19:14:27.872067,2023-02-14 19:15:45.136694,0 days 00:01:17.264627,,,,LGBM,0.6940921656473806,,,,,,0.018786822106684597,7.0,161.0,,62.0,,939.0,,,,0.0069733021526455,0.0019311211818795993,0.8385748739523367,COMPLETE
94,1239.6022953699105,2023-02-14 19:15:45.137694,2023-02-14 19:16:51.426818,0 days 00:01:06.289124,,,,LGBM,0.6502431183864404,,,,,,0.014256279454344907,6.0,230.0,,27.0,,876.0,,,,0.021826463522856974,0.0737970299461038,0.7396192782986459,COMPLETE
95,1252.5952864606927,2023-02-14 19:16:51.428818,2023-02-14 19:18:36.957896,0 days 00:01:45.529078,,,,LGBM,0.5888928027282525,,,,,,0.014064872732720573,10.0,230.0,,19.0,,870.0,,,,0.015789532180245924,0.0048619232242884955,0.6863892934715817,COMPLETE
96,1240.9270910435182,2023-02-14 19:18:36.959899,2023-02-14 19:19:45.492533,0 days 00:01:08.532634,,,,LGBM,0.6477506863097809,,,,,,0.009590216892187812,6.0,242.0,,27.0,,793.0,,,,0.036862972729741546,0.1390508851858644,0.7069946359244097,COMPLETE
97,1292.5204650592073,2023-02-14 19:19:45.493532,2023-02-14 19:23:35.168930,0 days 00:03:49.675398,0.4590716248311778,,,XGB,0.6442957338988347,,0.7169211285940904,,,0.006387160351884245,0.00733294595235821,8.0,,213.0,,3384.0,,,,,,,0.5914972481278002,COMPLETE
98,1245.3446823501263,2023-02-14 19:23:35.170931,2023-02-14 19:25:16.956152,0 days 00:01:41.785221,,,,LGBM,0.609927441069359,,,,,,0.009173903867567298,9.0,206.0,,28.0,,745.0,,,,0.031210188814397175,0.15755841390666067,0.7328632367613717,COMPLETE
99,1247.1970631616164,2023-02-14 19:25:16.957153,2023-02-14 19:26:35.722123,0 days 00:01:18.764970,,,,LGBM,0.6835503661208064,,,,,,0.011161682767183278,7.0,216.0,,26.0,,801.0,,,,0.0392911164811486,0.07985319052665438,0.7059588657043461,COMPLETE
